{
  "pack_id": "GRILL-AUTH-1",
  "version": "1.0",
  "activation": {"always": false, "surface_kinds": [], "topology_tags": ["AUTH"]},
  "axes": [
    {"id": "registration", "description": "Registration policy and registration failure behavior.", "independent_decision": true, "materiality_floor": "INHERIT"},
    {"id": "verification", "description": "Identity verification policy and failure behavior.", "independent_decision": true, "materiality_floor": "INHERIT"},
    {"id": "login", "description": "Login policy and authentication failure behavior.", "independent_decision": true, "materiality_floor": "INHERIT"},
    {"id": "logout", "description": "Logout behavior and resulting session state.", "independent_decision": true, "materiality_floor": "INHERIT"},
    {"id": "session_expiry", "description": "Session expiry policy and expired-session behavior.", "independent_decision": true, "materiality_floor": "MATERIAL"},
    {"id": "session_renewal", "description": "Session renewal policy and renewal failure behavior.", "independent_decision": true, "materiality_floor": "INHERIT"},
    {"id": "password_reset", "description": "Password reset policy and reset failure behavior.", "independent_decision": true, "materiality_floor": "MATERIAL"},
    {"id": "account_recovery", "description": "Account recovery policy and recovery failure behavior.", "independent_decision": true, "materiality_floor": "MATERIAL"},
    {"id": "revocation", "description": "Credential and session revocation policy.", "independent_decision": true, "materiality_floor": "MATERIAL"},
    {"id": "role_change", "description": "Authentication behavior when an account role changes.", "independent_decision": true, "materiality_floor": "MATERIAL"},
    {"id": "provider_failure", "description": "Behavior when an identity provider fails.", "independent_decision": true, "materiality_floor": "INHERIT"},
    {"id": "duplicate_identity", "description": "Policy for duplicate identities and identity collisions.", "independent_decision": true, "materiality_floor": "MATERIAL"},
    {"id": "account_linking", "description": "Policy for linking multiple identities to an account.", "independent_decision": true, "materiality_floor": "MATERIAL"}
  ]
}
